Brand,Video Title,YouTube URL
ACURA,How to Find Your ACURA Paint Code,https://www.youtube.com/watch?v=6ac1ARi5NFw
AUDI,How to Find Your AUDI Paint Code,https://www.youtube.com/watch?v=Tc9qrT1Cuhk
BMW,How to Find Your BMW Paint Code,https://www.youtube.com/watch?v=g6ouTFTBEGs
BUICK,How to Find Your BUICK Paint Code,https://www.youtube.com/watch?v=7kXAmENKeYQ
CADILLAC,How to Find Your CADILLAC Paint Code,https://www.youtube.com/watch?v=-y5vyHopVh4
CHEVROLET,How to Find Your CHEVROLET Paint Code,https://www.youtube.com/watch?v=dDTwgGPwlcY
CHRYSLER,How To Find Your CHRYSLER Paint Code,https://www.youtube.com/watch?v=qos3bMMdpI8
DODGE,How to Find Your DODGE Paint Code,https://www.youtube.com/watch?v=DpI6_DeskSI
FORD,How to find your FORD paint code,https://www.youtube.com/watch?v=ukU9f4EfYsE
GENESIS,How to Find your Genesis Paint Code,https://www.youtube.com/watch?v=H6DbrbLkux4
GMC,How to Find Your GMC Paint Code,https://www.youtube.com/watch?v=ius2pE4_xSo
HONDA,How to Find Your HONDA Paint Code,https://www.youtube.com/watch?v=8T32UeZ8rfA
HUMMER,How to Find your HUMMER Paint Code,https://www.youtube.com/watch?v=cGByzt5pfNk
HUMMER,How to Find your Hummer Paint Code,https://www.youtube.com/watch?v=iEDxp2S5DE4
HYUNDAI,How to find your HYUNDAI Paint Code,https://www.youtube.com/watch?v=lVZ7qRa1vuk
INFINITI,How to Find Your INFINITI Paint Code,https://www.youtube.com/watch?v=fCyexMUvGqY
ISUZU,How to Find your Isuzu Paint Code,https://www.youtube.com/watch?v=_aw5pgvImLo
JAGUAR,How to Find your JAGUAR Paint Code,https://www.youtube.com/watch?v=BKgkNyEc5-c
JEEP,How to Find Your JEEP Paint Code,https://www.youtube.com/watch?v=G17_43SpORQ
KIA,How to Find Your KIA Paint Code,https://www.youtube.com/watch?v=XW1OGzr0uZQ
LAND ROVER,How to find your LAND ROVER Paint Code,https://www.youtube.com/watch?v=W2uSQniG18U
LINCOLN,How to Find your LINCOLN Paint Code,https://www.youtube.com/watch?v=xE8l9wb3Gu0
LEXUS,How to Find Your LEXUS Paint Code,https://www.youtube.com/watch?v=SygC3FQ6LzU
MAZDA,How to find your MAZDA Paint Code,https://www.youtube.com/watch?v=E3izE4R4_z4
MERCEDES,How to Find Your MERCEDES Paint Code,https://www.youtube.com/watch?v=0MJ36WM8XGs
MERCURY,How to Find your Mercury Paint Code,https://www.youtube.com/watch?v=yn4WYKcFebw
MINI COOPER,How To Find Your MINI COOPER Paint Code,https://www.youtube.com/watch?v=UIZvOPjwqiE
MITSUBISHI,How to Find Your MITSUBISHI Paint Code,https://www.youtube.com/watch?v=JLOWI1qjHyE
NISSAN,How to Find Your NISSAN Paint Code,https://www.youtube.com/watch?v=ODNvlIkdarw
OLDSMOBILE,How to Find your Oldsmobile Paint Code,https://www.youtube.com/watch?v=CAWIZ0HhxdU
PLYMOUTH,How to Find your Plymouth Paint Code,https://www.youtube.com/watch?v=o2IpP6WRBr8
PONTIAC,How to Find your PONTIAC Paint Code,https://www.youtube.com/watch?v=i6DzXLxjCnM
PORSCHE,How to Find Your PORSCHE Paint Code,https://www.youtube.com/watch?v=l0_OI_1NwBc
SAAB,How to Find your Saab Paint Code,https://www.youtube.com/watch?v=rqeya1Ym3SU
SATURN,How to Find your Saturn Paint Code,https://www.youtube.com/watch?v=Fwd9rQ8otFw
SCION,How To Find Your SCION Paint Code,https://www.youtube.com/watch?v=Ov2y1lnlbsg
SMART,How to Find your Smart Car Paint Code,https://www.youtube.com/watch?v=jMI-Ur1Enyo
SUBARU,How to Find Your SUBARU Paint Code,https://www.youtube.com/watch?v=yIiiYRp0PfQ
TESLA,How to Find Your TESLA Paint Code,https://www.youtube.com/watch?v=s1v5_NDEqDQ
TOYOTA,How to Find Your TOYOTA Paint Code,https://www.youtube.com/watch?v=MkBLXibP4Wk
VOLKSWAGEN,How to Find Your VOLKSWAGEN Paint Code,https://www.youtube.com/watch?v=Gzb2-rxV9Q4
VOLVO,How To Find Your VOLVO Paint Code,https://www.youtube.com/watch?v=RWmqoGzokFI
